{
  "$schema": "../schemas/next-public-entrypoints.schema.json",
  "schemaVersion": 1,
  "packages": {
    "next": {
      "name": "next",
      "version": "16.2.12"
    },
    "typescript": {
      "importName": "typescript",
      "name": "@typescript/typescript6",
      "version": "6.0.2"
    }
  },
  "entrypoints": [
    {
      "module": "next",
      "source": {
        "kind": "module"
      },
      "priority": "P0",
      "fixture": "tests/next-surface/fixtures.json#p0-core-types",
      "selectionRationale": "Bind the App Router configuration and metadata contracts without importing the complete Pages Router-oriented root surface.",
      "exports": [
        {
          "name": "NextConfig",
          "kind": "type",
          "stability": "stable",
          "signatureHash": "sha256:e7f519c7fdf899381c233d28855ca1a9dc936235dab220f2e6cfe5bd7d6c6e87",
          "haxeTypePath": "nextjs.raw.NextConfig",
          "exposure": "raw-only"
        },
        {
          "name": "Metadata",
          "kind": "type",
          "stability": "stable",
          "signatureHash": "sha256:2f0bf8024c0199975df23772a4a4fc4dc58f4d3c6e2ea65b5825336f460a175b",
          "haxeTypePath": "nextjs.raw.metadata.Metadata",
          "exposure": "raw-and-semantic"
        },
        {
          "name": "ResolvingMetadata",
          "kind": "type",
          "stability": "stable",
          "signatureHash": "sha256:10a8438ac22c574d18dfbfeadbcfd31910bb0056fc352ed618138799a58d2fb4",
          "haxeTypePath": "nextjs.raw.metadata.ResolvingMetadata",
          "exposure": "raw-only"
        },
        {
          "name": "Viewport",
          "kind": "type",
          "stability": "stable",
          "signatureHash": "sha256:11628a08d0f9ac5de6f4204dfb0b9c3e24f08a2a9172de6a4e2564047980acb1",
          "haxeTypePath": "nextjs.raw.metadata.Viewport",
          "exposure": "raw-and-semantic"
        },
        {
          "name": "ResolvingViewport",
          "kind": "type",
          "stability": "stable",
          "signatureHash": "sha256:b416f9e552943e66e1af1b4a9ddb8ac1b700a59e53942e99577d177858f07f27",
          "haxeTypePath": "nextjs.raw.metadata.ResolvingViewport",
          "exposure": "raw-only"
        }
      ]
    },
    {
      "module": "next/types",
      "source": {
        "kind": "module"
      },
      "priority": "P0",
      "fixture": "tests/next-surface/fixtures.json#p0-core-types",
      "selectionRationale": "Expose only the route and server-runtime types needed at App Router boundaries; the wider legacy data-fetching surface stays native.",
      "exports": [
        {
          "name": "Route",
          "kind": "type",
          "stability": "stable",
          "signatureHash": "sha256:00a3fb74517d190c41aaca0156f94c72e778efacc0cc98d6ba71e2610e75e175",
          "haxeTypePath": "nextjs.raw.Route",
          "exposure": "raw-and-semantic"
        },
        {
          "name": "ServerRuntime",
          "kind": "type",
          "stability": "stable",
          "signatureHash": "sha256:4f39fd954bd488855f3403e10efa7f2de15fa97baa423a8ecdb14ceb705238a5",
          "haxeTypePath": "nextjs.raw.ServerRuntime",
          "exposure": "raw-only"
        }
      ]
    },
    {
      "module": "next/link",
      "source": {
        "kind": "module"
      },
      "priority": "P0",
      "fixture": "tests/next-surface/fixtures.json#p0-components",
      "selectionRationale": "Cover the documented default component, its props, and link-status hook while leaving implementation helpers private.",
      "exports": [
        {
          "name": "default",
          "kind": "component",
          "stability": "stable",
          "signatureHash": "sha256:824862ef93de7d0e9b075b1e549d1f2d0c2a86f1e4a9fdada39764444c45871a",
          "haxeTypePath": "nextjs.raw.components.Link",
          "exposure": "raw-and-semantic"
        },
        {
          "name": "LinkProps",
          "kind": "type",
          "stability": "stable",
          "signatureHash": "sha256:4fc42af13a0c32ec07c56b3a5aeb0f979dd63f8fe26a9c581f840381d6c51664",
          "haxeTypePath": "nextjs.raw.components.LinkProps",
          "exposure": "raw-and-semantic"
        },
        {
          "name": "useLinkStatus",
          "kind": "function",
          "stability": "stable",
          "signatureHash": "sha256:0b168b8d2ec32c9cca4b8b4bd41ed452f827fd72db75428464f8bcc4c50f69c0",
          "haxeTypePath": "nextjs.raw.components.Link",
          "haxeMember": "useLinkStatus",
          "exposure": "raw-only"
        }
      ]
    },
    {
      "module": "next/image",
      "source": {
        "kind": "module"
      },
      "priority": "P0",
      "fixture": "tests/next-surface/fixtures.json#p0-components",
      "selectionRationale": "Bind the documented image component, loader contracts, static data, and pure props helper without exposing optimizer internals.",
      "exports": [
        {
          "name": "default",
          "kind": "component",
          "stability": "stable",
          "signatureHash": "sha256:12ca137b361aa162ba2a8f3031880224935843c17956a764be05a37a3fd7e46e",
          "haxeTypePath": "nextjs.raw.components.Image",
          "exposure": "raw-and-semantic"
        },
        {
          "name": "getImageProps",
          "kind": "function",
          "stability": "stable",
          "signatureHash": "sha256:8a137c14f5a7ffddc1ed54791500fba2dc351ad859df12f112672b90c797bd1e",
          "haxeTypePath": "nextjs.raw.components.Image",
          "haxeMember": "getImageProps",
          "exposure": "raw-only"
        },
        {
          "name": "ImageLoaderProps",
          "kind": "type",
          "stability": "stable",
          "signatureHash": "sha256:bbf83174a7da3dc0e2f0f74b8588299894e12bdd97a65e4d38ee5c56e547b7ae",
          "haxeTypePath": "nextjs.raw.components.ImageLoaderProps",
          "exposure": "raw-only"
        },
        {
          "name": "ImageProps",
          "kind": "type",
          "stability": "stable",
          "signatureHash": "sha256:7c266d2c9afe01ee0dd2f918a84fc56d50cb2b8615fa2e7c6f2bd88b83c1c266",
          "haxeTypePath": "nextjs.raw.components.ImageProps",
          "exposure": "raw-and-semantic"
        },
        {
          "name": "StaticImageData",
          "kind": "type",
          "stability": "stable",
          "signatureHash": "sha256:1b7ac855b22c4694b5d5bb33ce9975dca8e997e8d580367d375e1cd73e2c6d38",
          "haxeTypePath": "nextjs.raw.components.StaticImageData",
          "exposure": "raw-only"
        }
      ]
    },
    {
      "module": "next/form",
      "source": {
        "kind": "module"
      },
      "priority": "P0",
      "fixture": "tests/next-surface/fixtures.json#p0-components",
      "selectionRationale": "Expose the complete documented App Router form component boundary and its closed props contract.",
      "exports": [
        {
          "name": "default",
          "kind": "component",
          "stability": "stable",
          "signatureHash": "sha256:2e76e2be8be45fc57b4a85faa77cc87873d1197db1895227145afd7f3d698e4f",
          "haxeTypePath": "nextjs.raw.components.Form",
          "exposure": "raw-and-semantic"
        },
        {
          "name": "FormProps",
          "kind": "type",
          "stability": "stable",
          "signatureHash": "sha256:28f79fb46d388d2b58abbd8b5f3994f3bccc84d09bd2727e026861887cb5e56c",
          "haxeTypePath": "nextjs.raw.components.FormProps",
          "exposure": "raw-and-semantic"
        }
      ]
    },
    {
      "module": "next/navigation",
      "source": {
        "kind": "module"
      },
      "priority": "P0",
      "fixture": "tests/next-surface/fixtures.json#p0-navigation",
      "selectionRationale": "Cover documented App Router hooks and non-returning navigation interrupts while excluding server-insertion and unstable error helpers.",
      "exports": [
        {
          "name": "ReadonlyURLSearchParams",
          "kind": "class",
          "stability": "stable",
          "signatureHash": "sha256:587f2d1b84d82e72ce4a3575c17d451c6d625103ddfa5eba7fb8d060acf9da95",
          "haxeTypePath": "nextjs.raw.navigation.ReadonlyURLSearchParams",
          "exposure": "raw-only"
        },
        {
          "name": "RedirectType",
          "kind": "value",
          "stability": "stable",
          "signatureHash": "sha256:d2b50c4586d638bdd7bb3ce47f3f3e4ac7a17b78ad2eab587f26f9ced4c54a3a",
          "haxeTypePath": "nextjs.raw.Navigation",
          "haxeMember": "RedirectType",
          "exposure": "raw-only"
        },
        {
          "name": "forbidden",
          "kind": "function",
          "stability": "stable",
          "signatureHash": "sha256:abec9c7b10b88c1d1b97e3eb62f08339b4fef6589f73723461fc5f753c05e9c0",
          "haxeTypePath": "nextjs.raw.Navigation",
          "haxeMember": "forbidden",
          "exposure": "raw-and-semantic"
        },
        {
          "name": "notFound",
          "kind": "function",
          "stability": "stable",
          "signatureHash": "sha256:6d255f4e57f9aa950d09d50ff4fb84294c34cfdc993531cbe6d9e263494eab78",
          "haxeTypePath": "nextjs.raw.Navigation",
          "haxeMember": "notFound",
          "exposure": "raw-and-semantic"
        },
        {
          "name": "permanentRedirect",
          "kind": "function",
          "stability": "stable",
          "signatureHash": "sha256:6e3c920beda76c5d7e4a68432c2593fe554fe6e3d351605996a728971ad9555c",
          "haxeTypePath": "nextjs.raw.Navigation",
          "haxeMember": "permanentRedirect",
          "exposure": "raw-and-semantic"
        },
        {
          "name": "redirect",
          "kind": "function",
          "stability": "stable",
          "signatureHash": "sha256:a9f7c9cec326a4c3d97323fb6c85b43717dff74e84a9b0edbdc4bd4fea6f4377",
          "haxeTypePath": "nextjs.raw.Navigation",
          "haxeMember": "redirect",
          "exposure": "raw-and-semantic"
        },
        {